<!ELEMENT listacompras (venta+)>
<!ELEMENT venta (ventaacredito | ventainmediata)>
<!ELEMENT ventaacredito (fechainpago?, cantidad)>
<!ELEMENT ventainmediata (cantidad, divisa)>
<!ELEMENT fechainpago (#PCDATA)>
<!ELEMENT cantidad (#PCDATA)>
<!ELEMENT divisa (#PCDATA)>